generic_name,commercial_name,description
KIT MOT MOTO G04S 128G 7 NG,Motorola Moto G04S 128GB Negro,"El Motorola Moto G04S 128GB Negro es un dispositivo que combina un diseño elegante con un rendimiento impresionante, ideal para aquellos que buscan un smartphone confiable y potente.

La pantalla del Motorola Moto G04S es de tipo LCD IPS, ofreciendo una resolución Full HD+ de 2400 x 1080 píxeles. Esta tecnología asegura colores vibrantes y ángulos de visión amplios, proporcionando una experiencia visual envolvente para todos tus contenidos favoritos.

En cuanto a las dimensiones, el Motorola Moto G04S mide aproximadamente 165 mm de alto, 75 mm de ancho y 9 mm de grosor, con un peso que ronda los 190 gramos. Su diseño ergonómico facilita su manejo diario, haciendo que se sienta cómodo en la mano.

Este modelo ofrece una capacidad de almacenamiento interno de 128GB, ampliable mediante tarjeta microSD, acompañada de 4GB de RAM, lo que garantiza un rendimiento fluido al ejecutar múltiples aplicaciones y almacenar tus fotos, videos y archivos sin preocupaciones.

La cámara del Motorola Moto G04S es uno de sus puntos fuertes, equipada con un sistema de triple cámara trasera, destacando un sensor principal de 48 MP que captura imágenes detalladas y nítidas, incluso en condiciones de poca luz. Además, cuenta con funciones avanzadas como el modo nocturno, HDR y grabación de video en alta definición.

El corazón del Motorola Moto G04S es un procesador Qualcomm Snapdragon 662, basado en una arquitectura de 64 bits, que proporciona un equilibrio perfecto entre potencia y eficiencia energética, permitiendo ejecutar aplicaciones y juegos con facilidad.

La batería del Motorola Moto G04S tiene una capacidad de 5,000 mAh, diseñada para ofrecer una duración prolongada, asegurando que puedas disfrutar de tu dispositivo durante todo el día sin preocuparte por quedarte sin energía. Además, cuenta con carga rápida, lo que te permite recargar el dispositivo rápidamente y volver a estar en marcha en poco tiempo."
KIT MOT MTG04128GXT24 NG,Motorola Moto G04 128GB Negro,"El Motorola Moto G04 128GB Negro es un dispositivo que combina elegancia y rendimiento, ideal para quienes buscan eficiencia y estilo en un solo paquete. 

Pantalla: El Motorola Moto G04 cuenta con una pantalla IPS LCD de 6.4 pulgadas con resolución Full HD+ de 2400 x 1080 píxeles. Esta tecnología garantiza colores vibrantes y una experiencia visual nítida, perfecta para disfrutar de contenido multimedia con gran detalle.

Dimensiones y Peso: Este modelo tiene unas dimensiones de aproximadamente 160.3 x 73.8 x 8.6 mm y un peso de alrededor de 180 gramos, lo que lo convierte en un dispositivo compacto y ligero, fácil de manejar con una sola mano.

Capacidad: El Motorola Moto G04 está equipado con 128GB de almacenamiento interno, ofreciendo espacio suficiente para tus aplicaciones, fotos y videos. Además, cuenta con 4GB de RAM, asegurando un rendimiento fluido y eficiente en multitarea.

Cámara: La cámara principal del Motorola Moto G04 es un sistema de triple lente, destacando un sensor principal de 48 MP que captura imágenes claras y detalladas, incluso en condiciones de poca luz. También incluye funciones avanzadas como modo nocturno y enfoque automático rápido, que facilitan la toma de fotos impresionantes.

Procesador: En su interior, el Motorola Moto G04 alberga un procesador Qualcomm Snapdragon 662 con arquitectura de 64 bits, garantizando un rendimiento óptimo para todas tus actividades diarias, desde la navegación por internet hasta el uso de juegos y aplicaciones exigentes.

Batería: Este modelo está equipado con una batería de 5000 mAh, diseñada para ofrecer una duracion prolongada, permitiéndote disfrutar de tus actividades sin preocuparte por quedarte sin energía. Además, cuenta con carga rápida, lo que te permite recargar el dispositivo rápidamente y volver a estar en marcha en poco tiempo."
KIT MOT MT G04128GXT24 AZ,Motorola Moto G04 128GB Azul,"El Motorola Moto G04 128GB Azul es un dispositivo diseñado para aquellos que buscan un equilibrio perfecto entre rendimiento y estilo. Este smartphone presenta una serie de especificaciones que lo convierten en una opción atractiva dentro de su categoría.

La pantalla del Motorola Moto G04 es de tipo IPS LCD, ofreciendo una resolución Full HD+ de 2400 x 1080 píxeles, lo que garantiza imágenes nítidas y colores vibrantes. Con una diagonal de 6.5 pulgadas, proporciona una experiencia visual inmersiva, ideal para consumir contenido multimedia y navegar por la web.

En cuanto a sus dimensiones, el Motorola Moto G04 mide aproximadamente 163 x 75 x 9 mm y tiene un peso de alrededor de 190 gramos, lo que lo hace cómodo de sostener y manejar con una sola mano.

El dispositivo cuenta con una capacidad de almacenamiento interno de 128GB, ampliable mediante tarjeta microSD, lo que proporciona espacio de sobra para aplicaciones, fotos y videos. Además, está equipado con 4GB de RAM, asegurando un rendimiento fluido al realizar múltiples tareas y ejecutar aplicaciones exigentes.

La cámara del Motorola Moto G04 es una de sus características destacadas. En la parte trasera, alberga un sistema de triple cámara con un sensor principal de 48 MP, que permite capturar imágenes detalladas y claras, incluso en condiciones de poca luz. La cámara frontal, de 13 MP, es perfecta para selfies y videollamadas de alta calidad.

Bajo el capó, el Motorola Moto G04 está impulsado por un procesador Qualcomm Snapdragon 680, basado en una arquitectura de 64 bits. Este chip asegura un rendimiento eficiente y rápido, permitiendo a los usuarios"
KIT MOT MTG24PW256GXT AZ,Motorola Moto G24 Power 256GB Azul,"Descubre el Motorola Moto G24 Power 256GB Azul, un dispositivo diseñado para aquellos que buscan rendimiento y estilo en un solo paquete. 

La pantalla del Motorola Moto G24 Power es una LCD IPS de 6.5 pulgadas con una resolución Full HD+ de 2400 x 1080 píxeles, que ofrece colores vibrantes y una claridad impresionante para disfrutar de tus contenidos favoritos al máximo.

Con unas dimensiones de 165.4 x 75.8 x 9.4 mm y un peso de aproximadamente 200 gramos, el Motorola Moto G24 Power está diseñado para ser manejable y cómodo en la mano, sin comprometer su robustez.

Este modelo llega con una impresionante capacidad de almacenamiento de 256GB, lo que te permite guardar más de tus fotos, videos y aplicaciones. Además, viene equipado con 8GB de RAM, garantizando una experiencia de usuario fluida y sin interrupciones.

La cámara del Motorola Moto G24 Power es otro de sus puntos fuertes, con un sistema de triple lente que incluye una cámara principal de 50 MP, diseñada para capturar imágenes detalladas y nítidas en cualquier condición de iluminación.

En su interior, el Motorola Moto G24 Power funciona con un procesador MediaTek Helio G96, una arquitectura de 64 bits que proporciona un rendimiento eficiente para todas tus tareas diarias, desde la multitarea hasta el gaming.

La batería de 5000 mAh del Motorola Moto G24 Power está diseñada para durar todo el día, permitiéndote disfrutar de tus actividades sin preocuparte por recargar. Su optimización energética asegura que puedas hacer más con cada carga.

El Motorola Moto G24 Power 256GB Azul es más que un smartphone; es una herramienta diseñada para acompañarte en tu día a día, ofreciendo un equilibrio perfecto entre estilo, rendimiento y funcionalidad."
KIT MOT MTG24PW256GXT ZC,Motorola Moto G24 Power 256GB Gris,"Descubre el Motorola Moto G24 Power 256GB Gris, un smartphone diseñado para llevar tu experiencia móvil al siguiente nivel. Con una impresionante pantalla IPS LCD de 6.5 pulgadas y resolución Full HD+ (2400 x 1080 píxeles), disfrutarás de imágenes nítidas y colores vibrantes en cada uso.

El elegante diseño del Motorola Moto G24 Power se complementa con dimensiones de 161 x 74 x 8.5 mm y un peso ligero de aproximadamente 190 gramos, garantizando un agarre cómodo y seguro.

Equipado con una generosa capacidad de almacenamiento de 256GB, este dispositivo ofrece espacio de sobra para todas tus fotos, videos y aplicaciones favoritas. Además, con 8GB de RAM, el multitasking es fluido y eficiente, permitiéndote cambiar entre tareas sin esfuerzo.

Captura tus momentos más preciados con la cámara principal de 50MP del Motorola Moto G24 Power, que ofrece fotos detalladas y vívidas. La cámara frontal de 16MP asegura selfies perfectas y videollamadas claras.

Bajo el capó, el Motorola Moto G24 Power cuenta con un procesador MediaTek Helio G85, diseñado para proporcionar un rendimiento rápido y eficiente con su arquitectura de 64 bits, optimizando tanto el uso de aplicaciones exigentes como el ahorro de energía.

Mantente conectado todo el día con su potente batería de 5000 mAh, que promete una duración prolongada para que puedas disfrutar de tu dispositivo sin interrupciones. Ya sea que estés navegando, jugando o transmitiendo contenido, el Motorola Moto G24 Power está preparado para seguirte el ritmo."
KIT MOT MG04S256G2421 NG,Motorola Moto G04S 256GB Negro,"El Motorola Moto G04S 256GB Negro es un dispositivo diseñado para quienes buscan un equilibrio perfecto entre rendimiento y estilo. Este smartphone cuenta con una pantalla IPS LCD de 6.5 pulgadas con una resolución Full HD+ de 2400 x 1080 píxeles, proporcionando imágenes nítidas y colores vibrantes ideales para disfrutar de cualquier contenido multimedia.

Con unas dimensiones de aproximadamente 165 x 75 x 9 mm y un peso de 190 gramos, el Motorola Moto G04S se siente sólido y cómodo en la mano, perfecto para el uso diario. 

En cuanto a capacidad, este modelo ofrece 256GB de almacenamiento interno, ampliable mediante tarjeta microSD para aquellos que necesiten aún más espacio. Además, está equipado con 8GB de RAM, lo que garantiza un rendimiento fluido y eficiente en la multitarea.

La cámara del Motorola Moto G04S es uno de sus grandes atractivos, destacándose con un sistema de triple cámara trasera con un sensor principal de 50 megapíxeles, permitiendo capturar imágenes claras y detalladas incluso en condiciones de poca luz. La cámara frontal, de 16 megapíxeles, es perfecta para selfies y videollamadas de alta calidad.

Potenciado por un procesador Qualcomm Snapdragon 680, el Motorola Moto G04S ofrece una experiencia de usuario rápida y sin interrupciones, optimizando la eficiencia energética y el rendimiento general del dispositivo.

La batería de 5,000 mAh del Motorola Moto G04S asegura una excelente duración, proporcionando energía suficiente para todo el día con un uso normal, y gracias a su carga rápida, estarás listo para continuar en poco tiempo."
KIT MOT MTG54128G2343 NG,Motorola Moto G54 128GB Negro,"Descubre la potencia y elegancia del Motorola Moto G54 128GB Negro, un dispositivo diseñado para ofrecerte una experiencia móvil superior.

Pantalla: Disfruta de cada detalle en su pantalla IPS LCD de 6.5 pulgadas con una resolución Full HD+ de 1080 x 2400 píxeles. La tecnología de su pantalla garantiza colores vibrantes y una claridad excepcional, ideal para tus contenidos favoritos.

Dimensiones y Peso: El Motorola Moto G54 presenta un diseño ergonómico con dimensiones de aproximadamente 161.6 x 73.8 x 8.9 mm y un peso de solo 192 gramos, lo que lo hace cómodo de sostener y fácil de llevar a cualquier parte.

Capacidad: Equipado con 128GB de almacenamiento interno, el Motorola Moto G54 te ofrece espacio suficiente para tus aplicaciones, fotos y archivos. Además, cuenta con 4GB de RAM que aseguran un rendimiento fluido y eficiente en multitarea.

Cámara: Captura momentos inolvidables con su sistema de cámara dual que incluye un sensor principal de 50 MP con enfoque automático y una cámara frontal de 13 MP para selfies nítidas y videollamadas de alta calidad.

Procesador: En su núcleo, el Motorola Moto G54 alberga un robusto procesador MediaTek Dimensity 7020, que con su arquitectura de 8 núcleos garantiza un rendimiento óptimo para todas tus aplicaciones y juegos.

Batería: Mantente activo durante todo el día gracias a su batería de 5000 mAh, diseñada para ofrecerte hasta 24 horas de uso continuo con una sola carga, asegurando que siempre estés conectado cuando más lo necesitas."
KIT MOT MTG34256GXT23 NG,Motorola Moto G34 256GB Negro,"Descripción Técnica y Promocional del Motorola Moto G34 256GB Negro

El Motorola Moto G34 256GB Negro es la combinación perfecta de elegancia, potencia y rendimiento, diseñado para adaptarse a las necesidades de los usuarios más exigentes.

Pantalla: Disfruta de una experiencia visual envolvente con su pantalla IPS LCD de 6.5 pulgadas, que ofrece una resolución Full HD+ de 1080 x 2400 píxeles. Esta tecnología asegura colores vibrantes y detalles nítidos, perfectos para ver tus series favoritas o disfrutar de los últimos juegos.

Dimensiones y Peso: Con un diseño estilizado, el Motorola Moto G34 mide aproximadamente 161.8 x 74 x 8.9 mm y tiene un peso de alrededor de 190 gramos. Su construcción ergonómica permite un manejo cómodo y seguro en cualquier situación.

Capacidad: Equipado con una impresionante capacidad de almacenamiento de 256GB, el Motorola Moto G34 te permite guardar todas tus fotos, vídeos y aplicaciones sin preocuparte por el espacio. Además, cuenta con 8GB de RAM, lo que garantiza una experiencia multitarea fluida y sin interrupciones.

Cámara: Captura tus momentos más preciados con su sistema de cámara triple. La cámara principal de 50 MP ofrece imágenes claras y detalladas, mientras que la lente ultra gran angular y el sensor de profundidad proporcionan versatilidad y creatividad a tus fotografías.

Procesador: Potenciado por el procesador Qualcomm Snapdragon 695, el Motorola Moto G34 asegura un rendimiento eficiente y rápido, optimizando el consumo de energía y mejorando la experiencia del usuario en cada interacción.

Batería: La batería de 5000 mAh del Motorola Moto G34 está diseñada para durar todo el día, permitiéndote disfrutar de tus aplicaciones y contenido multimedia sin preocuparte por quedarte sin energía. Además, la carga rápida de 30W te permite recargar tu dispositivo rápidamente, asegurando que siempre estés listo para seguir adelante."
KIT MOT MTG34256GXT23 VR,Motorola Moto G34 256GB Verde,"Descubre el nuevo Motorola Moto G34 256GB Verde, un smartphone diseñado para ofrecerte un rendimiento excepcional y una experiencia visual increíble. Este dispositivo cuenta con una pantalla IPS LCD de 6.5 pulgadas con resolución Full HD+ (2400 x 1080 píxeles), que te garantiza colores vibrantes y detalles nítidos, ideal para disfrutar de tus contenidos favoritos.

El Motorola Moto G34 está cuidadosamente diseñado con dimensiones de 161.9 x 73.9 x 8.6 mm y un peso de aproximadamente 185 gramos, asegurando un agarre cómodo y ligero para un uso prolongado.

Con una generosa capacidad de almacenamiento de 256GB, ampliable mediante tarjeta microSD, y una memoria RAM de 8GB, este smartphone te ofrece un rendimiento fluido para ejecutar múltiples aplicaciones y almacenar todo lo que necesitas sin preocupaciones.

La cámara principal del Motorola Moto G34 es una triple cámara con un sensor principal de 50 MP, que te permite capturar fotos impresionantes con detalles excepcionales. Además, cuenta con funciones avanzadas como el modo nocturno y enfoque automático, para que tus imágenes sean siempre de calidad profesional.

Equipada con un procesador Qualcomm Snapdragon 680, el Motorola Moto G34 garantiza un rendimiento rápido y eficiente, perfecto para tareas diarias y juegos. Su arquitectura de 8 núcleos asegura una experiencia multitarea sin interrupciones.

Por último, la batería de 5000 mAh del Motorola Moto G34 te ofrece una duración impresionante, permitiéndote disfrutar de hasta dos días de uso con una sola carga. Además, con la tecnología de carga rápida, tendrás tu dispositivo listo para seguir el ritmo de tu día en poco tiempo.

El Motorola Moto G34 256GB Verde es más que un smartphone; es una herramienta diseñada para acompañarte en tu día a día, ofreciendo un equilibrio perfecto entre estilo, rendimiento y funcionalidad."
KIT MOT MTG34256GXT23 AZ,Motorola Moto G34 256GB Azul,"### Descripción del Motorola Moto G34 256GB Azul

El Motorola Moto G34 256GB Azul es un dispositivo que combina tecnología avanzada y diseño elegante para ofrecer una experiencia móvil excepcional. Este smartphone está diseñado para aquellos que buscan rendimiento y estilo en un solo paquete.

Pantalla:  
El Motorola Moto G34 cuenta con una impresionante pantalla IPS LCD de 6.5 pulgadas, con una resolución Full HD+ de 2400 x 1080 píxeles. Esta pantalla ofrece colores vibrantes y detalles nítidos, ideal para disfrutar de videos, juegos y navegación web con una claridad excepcional.

Dimensiones y Peso:  
Este dispositivo tiene unas dimensiones aproximadas de 161.9 mm de altura, 73.9 mm de ancho y 8.6 mm de grosor. Su peso es de aproximadamente 180 gramos, lo que lo hace cómodo de sostener y fácil de llevar a cualquier lugar.

Capacidad:  
El Motorola Moto G34 Azul viene equipado con 256GB de almacenamiento interno, lo que proporciona amplio espacio para tus aplicaciones, fotos y documentos. Además, cuenta con 8GB de RAM, garantizando un rendimiento fluido y eficiente incluso en tareas multitarea.

Cámara:  
El sistema de cámaras del Moto G34 es uno de sus puntos fuertes. Incorpora una cámara principal de 50 MP que captura imágenes con gran detalle y nitidez, además de una cámara ultra gran angular y un sensor de profundidad para lograr fotografías versátiles y creativas en cualquier situación.

Procesador:  
En su interior, el Motorola Moto G34 está potenciado por un procesador Qualcomm Snapdragon 695, un chipset octa-core que ofrece un equilibrio perfecto entre rendimiento y eficiencia energética. Este procesador permite ejecutar aplicaciones exigentes y juegos con facilidad, optimizando la experiencia del usuario.
Batería:
La batería de 5000 mAh del Motorola Moto G34 asegura una duración prolongada, permitiéndote disfrutar de tus actividades diarias sin preocuparte por quedarte sin energía. Además, cuenta con carga rápida de 30W, lo que te permite recargar el dispositivo rápidamente y volver a estar en marcha en poco tiempo."
KIT MOT MTG34256GXT23 NG +PARLAN Z 1070,Motorola G34 256GB Negro + Parlante Z-1070,"El Motorola G34 256GB Negro + Parlante Z-1070 es la combinación perfecta de rendimiento y estilo, diseñado para aquellos que buscan una experiencia móvil completa sin comprometer la calidad.

Pantalla: Equipado con una pantalla IPS LCD de 6.5 pulgadas, el Motorola G34 ofrece una resolución Full HD+ que garantiza una visualización nítida y vibrante. La tecnología avanzada de su pantalla permite colores precisos y detalles impresionantes, ideal para disfrutar de contenido multimedia y juegos.

Dimensiones y Peso: Con un diseño elegante y moderno, el Motorola G34 mide aproximadamente 162.7 x 75.9 x 9.1 mm y tiene un peso cómodo de 200 gramos, lo que lo hace perfecto para llevar en la mano o en el bolsillo sin esfuerzo.

Capacidad: Este modelo proporciona un almacenamiento interno de 256GB, ofreciendo espacio más que suficiente para todas tus aplicaciones, fotos y videos. Además, cuenta con 8GB de RAM, asegurando un rendimiento fluido incluso cuando se ejecutan múltiples aplicaciones de manera simultánea.

Cámara: El Motorola G34 está equipado con un sistema de cámara triple, destacándose su sensor principal de 50 MP, que captura imágenes impresionantes en cualquier condición de luz. La cámara también ofrece funciones avanzadas como el modo nocturno y grabación de vídeo en alta resolución.

Procesador: En su interior, el Motorola G34 alberga un potente procesador MediaTek Helio G85, construido bajo una arquitectura de 12 nm. Este chip garantiza un rendimiento eficiente y rápido, optimizando tanto el uso diario como las sesiones de juego más exigentes.

Batería: Con una batería de 5,000 mAh, el Motorola G34 está diseñado para durar todo el día. Disfruta de horas de uso sin preocuparte por quedarte sin energía. Además, cuenta con carga rápida de 30W, lo que te permite recargar el dispositivo rápidamente y volver a estar en marcha en poco tiempo.
Parlante Z-1070: El paquete incluye el Parlante Z-1070, un dispositivo portátil que ofrece un sonido de alta calidad y una excelente duración de batería. Con su diseño compacto y ligero, es perfecto para llevarlo a cualquier lugar y disfrutar de tu música favorita con un sonido envolvente."
KIT MOT MTG54128G2343 AZ,Motorola Moto G54 128GB Azul,"El Motorola Moto G54 128GB Azul es un dispositivo diseñado para quienes buscan rendimiento y estilo en un solo paquete. Con una pantalla LCD IPS de 6.5 pulgadas, ofrece una resolución Full HD+ de 2400 x 1080 píxeles que garantiza una experiencia visual nítida y vibrante.

En términos de dimensiones, el Motorola Moto G54 mide aproximadamente 161.6 x 73.8 x 8.9 mm y tiene un peso de alrededor de 192 gramos, lo que lo hace cómodo para manejar y llevar en el bolsillo.

Este modelo viene con 128GB de almacenamiento interno, ampliable mediante tarjeta microSD, y está equipado con 4GB de RAM, asegurando un rendimiento fluido en multitarea y almacenamiento suficiente para aplicaciones y archivos importantes.

La cámara principal del Motorola Moto G54 cuenta con un sensor de 50 MP que permite capturar imágenes con gran detalle y claridad, acompañado de funciones avanzadas de fotografía para mejorar tus capturas.

En su interior, el dispositivo alberga un procesador MediaTek Dimensity 7020, basado en una arquitectura de 6 nm, que proporciona un rendimiento eficiente y una experiencia de usuario optimizada. 

La batería de 5000 mAh del Motorola Moto G54 promete una duración prolongada para acompañarte durante todo el día, con soporte para carga rápida que te permite recargar en menos tiempo y mantenerte siempre conectado.

El Motorola Moto G54 128GB Azul combina tecnología de vanguardia con un diseño elegante, ofreciendo una experiencia de usuario excepcional para quienes buscan lo mejor en un smartphone de gama media."
KIT MOT MTG85256GXT24 GR,Motorola Moto G85 256GB Gris,"Descubre el Motorola Moto G85 256GB Gris, un smartphone diseñado para ofrecerte una experiencia móvil excepcional. 

Pantalla: El Motorola Moto G85 cuenta con una pantalla IPS LCD de 6.5 pulgadas que proporciona una resolución Full HD+ de 2400 x 1080 píxeles. La tecnología de su pantalla garantiza imágenes nítidas y colores vibrantes, perfectos para disfrutar de tus videos y juegos favoritos.

Dimensiones y Peso: Con unas dimensiones aproximadas de 162.7 x 74.6 x 8.9 mm y un peso de alrededor de 200 gramos, el Motorola Moto G85 ofrece un diseño ergonómico y cómodo de manejar, ideal para el uso diario.

Capacidad: Equipado con 256GB de almacenamiento interno, el Motorola Moto G85 te ofrece espacio más que suficiente para todas tus aplicaciones, fotos y videos. Además, cuenta con 8GB de RAM para un rendimiento fluido y sin interrupciones.

Cámara: La cámara principal del Motorola Moto G85 es un sistema de triple lente que incluye un sensor principal de 50 MP. Captura fotos impresionantes con detalles claros y colores brillantes. La cámara frontal de 13 MP es perfecta para selfies y videollamadas de alta calidad.

Procesador: En su núcleo, el Motorola Moto G85 alberga un potente procesador MediaTek Helio G85, basado en una arquitectura de 12 nanómetros, que asegura un rendimiento eficiente y una experiencia de usuario rápida y receptiva.

Batería: Con una batería de 5000 mAh, el Motorola Moto G85 está diseñado para durar todo el día. Disfruta de horas de uso sin preocuparte por quedarte sin energía. Además, cuenta con carga rápida de 30W, lo que te permite recargar el dispositivo rápidamente y volver a estar en marcha en poco tiempo."
KIT OPP A38 128GB DO,Oppo A38 128 GB Dorado,"El Oppo A38 128 GB Dorado es un dispositivo que combina elegancia y rendimiento en un diseño compacto. Con una pantalla de 6.56 pulgadas, ofrece una resolución HD+ de 1612 x 720 píxeles, apoyada por la tecnología LCD IPS para asegurar colores vibrantes y un brillo adecuado desde cualquier ángulo.

En términos de dimensiones, el Oppo A38 mide aproximadamente 163.74 x 75.03 x 8.16 mm y tiene un peso de alrededor de 190 gramos, lo que lo hace cómodo de sostener y manejar durante todo el día.

Este modelo ofrece una generosa capacidad de almacenamiento de 128 GB, ampliable mediante tarjeta microSD, junto con 4 GB de RAM para mantener un rendimiento fluido y eficiente al ejecutar aplicaciones y tareas múltiples.

La cámara principal del Oppo A38 destaca con un sensor de 50 MP, complementado por un sensor de profundidad de 2 MP, permitiendo capturar fotografías nítidas y detalladas. La cámara frontal, de 5 MP, asegura selfies claras y videollamadas de alta calidad.

El corazón del Oppo A38 es un procesador MediaTek Helio G85, basado en una arquitectura de 12 nanómetros, que proporciona un equilibrio óptimo entre eficiencia energética y capacidad de procesamiento para las tareas diarias.

La batería, con una capacidad de 5000 mAh, promete una duración prolongada, permitiendo al usuario disfrutar del teléfono durante todo el día con una sola carga, ideal para quienes necesitan un dispositivo confiable en su rutina diaria.

El Oppo A38 128 GB Dorado es la elección perfecta para aquellos que buscan un smartphone elegante, con una buena capacidad de almacenamiento y un rendimiento"
