generic_name,commercial_name,description
KIT XIA 14T512GB NG,Xiaomi 14T 512GB Negro,"Explora el futuro de la tecnología móvil con el Xiaomi 14T 512GB Negro, una obra maestra de la innovación y el diseño. Este dispositivo redefine lo que significa tener el control en la palma de tu mano, combinando rendimiento, estilo y funcionalidad en un solo paquete impresionante.

Pantalla: El Xiaomi 14T cuenta con una pantalla AMOLED de 6.67 pulgadas que ofrece una resolución de 2400 x 1080 píxeles, proporcionando una experiencia visual vibrante y nítida. Con tecnología HDR10+, cada imagen se presenta con un color y contraste excepcionales, desde los vídeos hasta las aplicaciones diarias.

Dimensiones y Peso: Diseñado para ser elegante y manejable, el Xiaomi 14T tiene unas dimensiones de 164.1 x 76.9 x 8.5 mm y un peso de aproximadamente 203 gramos, lo que garantiza comodidad y facilidad de uso en cualquier situación.

Capacidad: Equipado con 512GB de almacenamiento interno, el Xiaomi 14T ofrece espacio más que suficiente para todas tus aplicaciones, fotos, vídeos y más. Además, con 12GB de RAM, la multitarea se convierte en una experiencia fluida y sin interrupciones.

Cámara: Captura el mundo con una claridad sorprendente gracias a su configuración de cámara triple, que incluye un sensor principal de 108 MP, un ultra gran angular de 8 MP y un sensor macro de 5 MP. La cámara frontal de 20 MP garantiza selfies perfectos en cualquier entorno.

Procesador: En su núcleo, el Xiaomi 14T está impulsado por el potente chip Qualcomm Snapdragon 8+ Gen 1, una"
KIT XIA RDNT14PR 5G 256 MR,Xiaomi Redmi Note 14 Pro 5G 256GB Morado,"Descubre el impresionante Xiaomi Redmi Note 14 Pro 5G 256GB Morado, un smartphone que redefine la experiencia móvil con su tecnología avanzada y diseño elegante. 

El Xiaomi Redmi Note 14 Pro 5G cuenta con una pantalla AMOLED de 6.67 pulgadas que ofrece una resolución Full HD+ de 2400 x 1080 píxeles, proporcionando colores vibrantes y un contraste excepcional para una experiencia visual inigualable.

En cuanto a su diseño, el dispositivo tiene unas dimensiones aproximadas de 163.6 x 75.8 x 8.9 mm y un peso de 204 gramos, lo que lo convierte en un teléfono cómodo de sostener y fácil de llevar.

Con una generosa capacidad de almacenamiento, el Xiaomi Redmi Note 14 Pro 5G viene con 256GB de almacenamiento interno, lo que te permite guardar todos tus archivos y aplicaciones esenciales. Además, está equipado con 8GB de RAM, asegurando un rendimiento fluido y eficiente incluso al ejecutar múltiples tareas.

La cámara del Xiaomi Redmi Note 14 Pro 5G es uno de sus puntos fuertes, destacando con un sistema de triple cámara trasera, liderado por un sensor principal de 108 MP que captura imágenes con una claridad y detalle sorprendentes, acompañado de un lente ultra gran angular y un sensor macro para una versatilidad fotográfica superior.

El corazón del Xiaomi Redmi Note 14 Pro 5G es su poderoso procesador Snapdragon 778G, basado en una arquitectura de 6 nm, que ofrece un rendimiento excepcional para juegos, streaming y más, manteniendo la eficiencia energética.

La batería de 5000 mAh asegura que puedas disfrutar de tus aplicaciones, juegos y contenido multimedia durante todo"
KIT XIA REDMI14C128GB NG,Xiaomi Redmi 14C 128GB Negro,"El Xiaomi Redmi 14C 128GB Negro es un smartphone diseñado para ofrecer un rendimiento excepcional y una experiencia visual impresionante. Con una pantalla de 6.53 pulgadas, este dispositivo cuenta con una resolución HD+ de 1600 x 720 píxeles, utilizando tecnología IPS para garantizar colores vibrantes y ángulos de visión amplios.

Este elegante teléfono tiene unas dimensiones aproximadas de 164.9 x 77.07 x 9 mm y un peso de 196 gramos, lo que lo hace cómodo de sostener y usar durante todo el día. 

En cuanto a capacidad, el Xiaomi Redmi 14C ofrece 128GB de almacenamiento interno, ampliable mediante tarjeta microSD para que nunca te quedes sin espacio. Además, está equipado con 4GB de RAM, permitiendo una operatividad fluida y multitarea sin esfuerzo.

La cámara principal de 50 MP captura imágenes nítidas y detalladas, complementada por funciones avanzadas de inteligencia artificial que mejoran cada captura. La cámara frontal de 5 MP asegura selfies claros y videollamadas de calidad.

Impulsado por un procesador MediaTek Helio G35, el Xiaomi Redmi 14C ofrece un rendimiento eficiente y confiable, optimizado para manejar aplicaciones y juegos con facilidad gracias a su arquitectura octa-core. 

La batería de 5000 mAh del Xiaomi Redmi 14C proporciona una duración prolongada, permitiendo hasta dos días de uso moderado con una sola carga, para que puedas disfrutar de tus aplicaciones, juegos y redes sociales sin preocuparte por quedarte sin energía.

Con el Xiaomi Redmi 14C 128GB Negro, obtienes un dispositivo que combina estilo, rendimiento y funcional"
KIT XIA REDMI A3 64GB AZ,Xiaomi Redmi A3 64GB Azul,"El Xiaomi Redmi A3 64GB Azul es un smartphone diseñado para ofrecer un equilibrio perfecto entre rendimiento y estilo. Con su pantalla IPS LCD de 6.3 pulgadas y una resolución de 720 x 1600 píxeles, este dispositivo ofrece imágenes nítidas y colores vibrantes para una experiencia visual inmersiva.

En cuanto a sus dimensiones, el Xiaomi Redmi A3 mide aproximadamente 164.9 x 77.1 x 9 mm y pesa alrededor de 194 gramos, lo que lo hace cómodo de manejar y transportar. 

Este modelo viene con 64GB de almacenamiento interno, ampliable mediante tarjeta microSD, y está equipado con 4GB de RAM, lo que asegura un rendimiento fluido al ejecutar múltiples aplicaciones y juegos.

La cámara principal del Xiaomi Redmi A3 incluye un sensor de 13 MP, ideal para capturar momentos especiales con claridad y detalle. Además, cuenta con varias funciones de fotografía, como HDR y modo panorámico, que mejoran la calidad de tus fotos.

Bajo el capó, el Xiaomi Redmi A3 está impulsado por un procesador MediaTek Helio G25, de arquitectura octa-core, que garantiza un rendimiento eficiente y un manejo efectivo de las tareas diarias y el entretenimiento.

La batería de este dispositivo tiene una capacidad de 5000 mAh, proporcionando una duración suficiente para un uso prolongado durante todo el día, ya sea navegando por la web, viendo videos o jugando.

El Xiaomi Redmi A3 64GB Azul combina características técnicas robustas con un diseño elegante, convirtiéndose en una opción atractiva para aquellos que buscan funcionalidad y estética a un precio accesible."
KIT XIA MI 9 AZ,Xiaomi Mi 9 Azul,"Presentamos el Xiaomi Mi 9 Azul, un smartphone que combina un diseño elegante con un rendimiento superior para ofrecer una experiencia móvil inigualable. 

La pantalla del Xiaomi Mi 9 Azul es una AMOLED de 6.39 pulgadas con una resolución Full HD+ de 2340 x 1080 píxeles, lo que garantiza colores vibrantes y detalles nítidos. Este dispositivo se siente ligero y cómodo en la mano, con unas dimensiones de 157.5 mm de alto, 74.67 mm de ancho y 7.61 mm de grosor, y un peso aproximado de 173 gramos.

En términos de capacidad, el Xiaomi Mi 9 Azul viene con opciones de almacenamiento de 64 GB o 128 GB, acompañadas de 6 GB de RAM, asegurando un rendimiento fluido y espacio suficiente para todas tus aplicaciones y archivos multimedia.

La cámara del Xiaomi Mi 9 Azul es un punto destacado, con un sistema de triple cámara trasera que incluye un sensor principal de 48 MP, un teleobjetivo de 12 MP y una cámara ultra gran angular de 16 MP. Esto permite capturar fotos impresionantes con gran claridad y detalle en cualquier situación.

Impulsado por el potente procesador Qualcomm Snapdragon 855, el Xiaomi Mi 9 Azul ofrece una arquitectura de 7 nm, proporcionando un rendimiento excepcional y eficiencia energética que satisfará a los usuarios más exigentes.

La batería de 3300 mAh del Xiaomi Mi 9 Azul asegura que puedas disfrutar de tu día sin preocupaciones, con una duración estimada que te permitirá mantenerte conectado y en funcionamiento durante horas, y además, soporta carga rápida de 27W y carga inalámbrica de 20W."
KIT XIA REDMI14C256GB NG,Xiaomi Redmi 14C 128GB Negro,"Descubre el Xiaomi Redmi 14C 128GB Negro, un dispositivo diseñado para ofrecer un rendimiento excepcional y una experiencia visual impresionante. Este smartphone cuenta con una pantalla LCD de 6.71 pulgadas, con una resolución HD+ de 1650 x 720 píxeles, que proporciona colores vibrantes y detalles nítidos para disfrutar al máximo de tus contenidos favoritos.

Con unas dimensiones de aproximadamente 168.8 x 76.4 x 8.8 mm y un peso de 190 gramos, el Xiaomi Redmi 14C es cómodo de sostener y fácil de llevar a cualquier lugar. Está equipado con 128GB de almacenamiento interno, ampliable mediante tarjeta microSD, y 4GB de RAM, ofreciendo un amplio espacio para tus aplicaciones, fotos y videos, así como un rendimiento fluido incluso en multitarea.

La cámara del Xiaomi Redmi 14C, con un sensor principal de 50 MP, está diseñada para capturar momentos excepcionales con gran claridad y detalle, sin importar las condiciones de luz. Además, su cámara frontal de 5 MP asegura selfies de calidad para compartir en tus redes sociales.

El corazón del Xiaomi Redmi 14C es su procesador MediaTek Helio G36, una arquitectura eficiente que garantiza un desempeño rápido y sin interrupciones, ideal para juegos y aplicaciones exigentes.

Con una batería de gran capacidad de 5000 mAh, el Xiaomi Redmi 14C te acompaña durante todo el día, ofreciéndote hasta 15 horas de reproducción de video, 31 horas de llamadas o 508 horas en modo de espera. Disfruta de una autonomía que se adapta a tu ritmo de vida. 

El Xiaomi Redmi 14C 128GB Negro es la"
KIT XIA REDMI A3 64GB NG,Xiaomi Redmi A3 64GB Negro,"Presentamos el Xiaomi Redmi A3 64GB Negro, un dispositivo diseñado para ofrecer un equilibrio perfecto entre rendimiento y funcionalidad, ideal para aquellos que buscan una experiencia móvil completa sin comprometer el estilo o el presupuesto.

La pantalla del Xiaomi Redmi A3 es una joya visual, con un panel IPS LCD que ofrece una resolución HD+ de 720 x 1600 píxeles. Esta tecnología asegura colores vibrantes y una claridad impresionante, perfecta para disfrutar de tus contenidos multimedia favoritos.

Con unas dimensiones compactas y ligeras, el Xiaomi Redmi A3 se adapta cómodamente a tu mano. Mide aproximadamente 164.9 x 76.75 x 9 mm y pesa alrededor de 194 gramos, haciendo que sea fácil de llevar contigo a todas partes sin que sea una carga.

En cuanto a capacidad, el Xiaomi Redmi A3 viene equipado con 64GB de almacenamiento interno, ampliable mediante tarjeta microSD, junto a 4GB de RAM que garantizan un rendimiento fluido y una multitarea eficiente.

La cámara del Xiaomi Redmi A3 es un elemento destacado, con un sistema de cámara trasera dual que incluye un sensor principal de 13 MP. Captura imágenes nítidas y detalladas, mientras que la cámara frontal de 5 MP es perfecta para selfies y videollamadas.

Bajo el capó, el Xiaomi Redmi A3 está impulsado por un procesador MediaTek Helio G25, un chip octa-core que ofrece un rendimiento fiable y eficiente, ideal para tareas cotidianas y aplicaciones de entretenimiento.

En cuanto a la batería, el Xiaomi Redmi A3 cuenta con una capacidad de 5000 mAh, proporcionando una duración prolongada que te permitirá disfrutar del dispositivo a"
KIT XIA RDNT14PR5G256 NG,Xiaomi Redmi Note 14 Pro 5G 256GB Negro,"El Xiaomi Redmi Note 14 Pro 5G 256GB Negro es una verdadera joya de la tecnología móvil, diseñado para aquellos que buscan rendimiento sin compromisos y un diseño elegante. 

Este dispositivo cuenta con una impresionante pantalla AMOLED de 6.67 pulgadas, que ofrece una resolución Full HD+ de 2400 x 1080 píxeles. La tecnología AMOLED garantiza colores vibrantes y un contraste excepcional, proporcionando una experiencia visual inmersiva ideal para disfrutar de contenido multimedia y juegos.

Con dimensiones de aproximadamente 161.5 x 75.3 x 8.1 mm y un peso de 192 gramos, el Xiaomi Redmi Note 14 Pro 5G es cómodo de sostener y manejar, sin sacrificar pantalla ni rendimiento.

Este modelo ofrece una potente combinación de almacenamiento y memoria, con 256GB de almacenamiento interno que te permite guardar todo lo que necesitas, desde aplicaciones hasta fotos y videos. Además, cuenta con 8GB de RAM, asegurando un rendimiento fluido incluso en las tareas más exigentes.

La cámara del Xiaomi Redmi Note 14 Pro 5G es un sistema avanzado que no pasa desapercibido. La cámara principal es de 108 MP, permitiendo capturar imágenes con una claridad y detalle excepcionales. También incluye lentes ultra gran angular y macro, perfectos para una variedad de escenarios fotográficos.

En su interior, el dispositivo está impulsado por el procesador Qualcomm Snapdragon 7+ Gen 2, con una arquitectura de 64 bits que asegura un rendimiento rápido y eficiente, ideal para multitarea y aplicaciones exigentes.

La batería de 5000 mAh del Xiaomi Redmi Note 14 Pro 5G promete una larga duración, permitiendo un uso intens"
KIT XIA REDMINT13256G AZ,Xiaomi Redmi Note 13 256GB Azul,"El Xiaomi Redmi Note 13 256GB Azul es una joya tecnológica que redefine la experiencia móvil con su impresionante conjunto de características avanzadas.

La pantalla del Xiaomi Redmi Note 13 es un deleite visual, equipada con un panel AMOLED de 6.67 pulgadas con una resolución Full HD+ de 2400 x 1080 píxeles. Esta tecnología de pantalla no solo proporciona colores vívidos y negros profundos, sino que también ofrece una experiencia de visualización inmersiva y fluida gracias a su tasa de refresco de 120 Hz.

En cuanto a dimensiones, el Xiaomi Redmi Note 13 presenta un diseño elegante y delgado, con medidas aproximadas de 161.4 x 74.2 x 8.1 mm y un peso ligero de alrededor de 190 gramos, lo que lo hace cómodo de sostener y fácil de llevar a cualquier parte.

Este modelo cuenta con una impresionante capacidad de almacenamiento de 256GB, acompañada de una generosa memoria RAM de 8GB, asegurando un rendimiento multitarea fluido y espacio más que suficiente para todas tus aplicaciones, fotos y videos.

El sistema de cámaras del Xiaomi Redmi Note 13 está diseñado para capturar momentos impresionantes. La cámara principal de 108 MP garantiza fotos de alta resolución y detalles excepcionales, mientras que las cámaras adicionales mejoran la versatilidad fotográfica con funciones como ultra gran angular y macro.

Impulsado por el potente procesador MediaTek Dimensity 810, el Xiaomi Redmi Note 13 ofrece un rendimiento eficiente y rápido, basado en una arquitectura de 6 nm que optimiza el consumo energético y mejora la ejecución de tareas complejas.

La batería de 5000 mAh del Xiaomi Redmi Note"
KIT XIA REDMINT13256G NG,Xiaomi Redmi Note 13 256GB Negro,"Descubre el Xiaomi Redmi Note 13 256GB Negro, un dispositivo que combina rendimiento, diseño y funcionalidad en un solo paquete. 

La pantalla del Xiaomi Redmi Note 13 es una obra maestra visual. Con tecnología AMOLED, ofrece una resolución FHD+ de 2400 x 1080 píxeles que garantiza imágenes nítidas y colores vibrantes, perfectos para disfrutar de tus contenidos favoritos. Su tamaño de 6.67 pulgadas proporciona una experiencia inmersiva y fluida.

En términos de dimensiones y peso, el Xiaomi Redmi Note 13 está diseñado para la comodidad y la portabilidad. Con unas medidas aproximadas de 161.1 x 75.4 x 8.3 mm y un peso de alrededor de 190 gramos, es lo suficientemente ligero como para llevarlo contigo todo el día sin inconvenientes.

Este modelo ofrece una impresionante capacidad de almacenamiento, con 256GB de espacio interno, asegurando que nunca te quedes sin espacio para tus aplicaciones, fotos y archivos importantes. Además, cuenta con 8GB de RAM, lo que proporciona un rendimiento multitarea sin esfuerzo y una experiencia de usuario fluida.

La cámara del Xiaomi Redmi Note 13 es un verdadero punto fuerte. La cámara trasera cuádruple incluye un sensor principal de 108 MP que captura fotos con detalles excepcionales, incluso en condiciones de poca luz. La cámara frontal de 16 MP garantiza selfies claros y vibrantes.

Impulsado por un procesador MediaTek Dimensity 920, el Xiaomi Redmi Note 13 ofrece un rendimiento excepcional con su arquitectura de 6 nm, proporcionando eficiencia energética y velocidad en todas tus tareas diarias.

La batería de 5000 mAh del Xiaomi Redmi Note"
KIT XIA REDNT13PRP512 MR +SMARTBAND 8,Xiaomi Redmi Note 13 Pro 512GB Morado + SmartBand 8,"El Xiaomi Redmi Note 13 Pro 512GB Morado + SmartBand 8 es un conjunto tecnológico que combina potencia, elegancia y funcionalidad. Este dispositivo está diseñado para aquellos que buscan rendimiento y estilo en un solo paquete.

La pantalla del Xiaomi Redmi Note 13 Pro es un impresionante panel AMOLED de 6.67 pulgadas, con una resolución Full HD+ de 2400 x 1080 píxeles. Esta tecnología proporciona colores vibrantes y un contraste excepcional, ideal para disfrutar de tus contenidos favoritos con la mejor calidad visual.

En cuanto a sus dimensiones, el Xiaomi Redmi Note 13 Pro mide aproximadamente 162.9 x 76 x 8.9 milímetros y pesa alrededor de 204 gramos, logrando un equilibrio perfecto entre tamaño manejable y robustez.

El almacenamiento es uno de los puntos fuertes de este dispositivo, ofreciendo una generosa capacidad de 512GB, acompañada de 8GB de RAM, lo que asegura un rendimiento fluido al manejar múltiples aplicaciones y almacenar una gran cantidad de datos sin preocupaciones.

La cámara del Xiaomi Redmi Note 13 Pro es una herramienta versátil para capturar momentos memorables. Cuenta con un sistema de triple cámara trasera, destacándose un sensor principal de 200 MP que captura imágenes nítidas y detalladas, complementada por lentes ultra gran angular y macro para mayor versatilidad en tus fotografías.

Impulsado por el procesador MediaTek Dimensity 1080, este smartphone ofrece una arquitectura de 6 nanómetros que equilibra eficiencia energética y potencia, garantizando un rendimiento óptimo en todas tus tareas diarias.

La batería de 5000 mAh del Xiaomi Redmi Note 13 Pro te proporciona la autonomía necesaria para todo"
KIT ZTE A75 128GB VR,ZTE A75 128GB Verde,"El ZTE A75 128GB Verde es un dispositivo que combina diseño elegante con un rendimiento notable, ideal para quienes buscan un smartphone confiable y con estilo.

Pantalla: El ZTE A75 cuenta con una pantalla IPS LCD de 6.5 pulgadas, que ofrece una resolución de 720 x 1600 píxeles. Esta tecnología proporciona colores vivos y una excelente claridad, perfecta para disfrutar de contenido multimedia.

Dimensiones y Peso: Con unas medidas aproximadas de 165 x 75 x 8.5 mm y un peso de 180 gramos, el ZTE A75 es cómodo de sostener y transportar, ofreciendo un equilibrio perfecto entre tamaño y funcionalidad.

Capacidad: Este modelo viene equipado con 128GB de almacenamiento interno, ampliables mediante tarjeta microSD, y 4GB de RAM, lo que garantiza un rendimiento fluido y espacio suficiente para todas tus aplicaciones, fotos y vídeos.

Cámara: El ZTE A75 está diseñado para capturar momentos inolvidables gracias a su cámara principal de 48 MP, que ofrece imágenes de alta calidad y detalles nítidos. La cámara frontal de 8 MP es ideal para selfies y videollamadas claras y definidas.

Procesador: En su interior, el ZTE A75 alberga un procesador MediaTek Helio G25 de ocho núcleos, basado en una arquitectura eficiente que asegura un rendimiento óptimo tanto en tareas cotidianas como en aplicaciones más exigentes.

Batería: Equipado con una batería de 5000 mAh, el ZTE A75 ofrece una duración prolongada que te permite disfrutar de tu día sin preocuparte por cargas frecuentes. Ya sea para trabajar, jugar o ver tus"
KIT XIA REDNT13PRP512 MR+BUDS 6 PLAY,Xiaomi Redmi Note 13 Pro 512GB Morado + BUDS 6 Play,"El Xiaomi Redmi Note 13 Pro 512GB Morado + BUDS 6 Play es un dispositivo que combina estilo y rendimiento en un solo paquete, diseñado para aquellos que buscan una experiencia móvil superior.

La pantalla del Xiaomi Redmi Note 13 Pro es un panel AMOLED de 6.67 pulgadas, ofreciendo una resolución Full HD+ de 2400 x 1080 píxeles. Esta tecnología asegura colores vivos y un contraste excepcional, ideal para disfrutar de contenido multimedia con la máxima calidad.

En cuanto a sus dimensiones, el dispositivo mide aproximadamente 161.4 x 74.2 x 8.9 mm y pesa alrededor de 204 gramos, lo que lo hace cómodo de usar y fácil de llevar a cualquier parte sin comprometer su robustez.

Este modelo viene con una impresionante capacidad de almacenamiento de 512GB, complementada por 12GB de RAM. Esto garantiza un rendimiento fluido y espacio de sobra para todas tus aplicaciones, fotos y videos.

La cámara del Xiaomi Redmi Note 13 Pro destaca por su configuración de triple lente, con un sensor principal de 200 MP que captura imágenes nítidas y detalladas, incluso en condiciones de poca luz. Además, incluye una cámara ultra gran angular y un sensor macro, ampliando tus posibilidades fotográficas.

En su interior, el dispositivo está equipado con un potente procesador Snapdragon 7s Gen 2 de 4 nm, que ofrece una arquitectura eficiente en energía y un rendimiento superior, perfecto para multitarea y juegos exigentes.

La batería de 5100 mAh del Xiaomi Redmi Note 13 Pro asegura una duración prolongada para que puedas disfrutar de tu día sin preocuparte por recargar frecuentemente. Además, gracias a su carga rápida de"
KIT XIA REDMINT13PR256 VR,Xiaomi Redmi Note 13 Pro 256GB Verde,"El Xiaomi Redmi Note 13 Pro 256GB Verde es un dispositivo que combina estilo y rendimiento en un diseño atractivo y moderno. 

La pantalla del Xiaomi Redmi Note 13 Pro es un panel AMOLED de 6.67 pulgadas con una resolución de 2400 x 1080 píxeles. Esta tecnología ofrece colores vibrantes y un contraste excepcional, ideal para disfrutar de contenido multimedia con una calidad visual impresionante.

En cuanto a sus dimensiones, el Xiaomi Redmi Note 13 Pro mide aproximadamente 161.4 x 74.2 x 8.2 mm y tiene un peso de alrededor de 187 gramos, lo que lo hace cómodo de manejar y fácil de llevar a cualquier parte.

Este modelo viene con una generosa opción de almacenamiento de 256GB, acompañada de 12GB de RAM, asegurando un rendimiento fluido incluso con múltiples aplicaciones en uso intensivo.

La cámara es uno de los puntos destacados del Xiaomi Redmi Note 13 Pro, con un sistema de cámara cuádruple en la parte trasera. La cámara principal de 200 MP captura imágenes con una claridad y detalle excepcionales, mientras que las lentes adicionales ofrecen opciones versátiles para fotografía de gran angular y macro.

El corazón del Xiaomi Redmi Note 13 Pro es el potente procesador MediaTek Dimensity 7200-Ultra, basado en una arquitectura de 4 nm, que proporciona un rendimiento rápido y eficiente, ideal para gaming y multitarea.

La batería de 5100 mAh del Xiaomi Redmi Note 13 Pro garantiza una duración prolongada, permitiendo un uso intensivo durante todo el día sin preocupaciones. Además, su soporte para carga rápida asegura que puedas recargar rápidamente y seguir disfrutando de todo lo que este dispositivo"
KIT XIA REDN13PR5G256 NG,Xiaomi Redmi Note 13 Pro 5G 256GB Negro,"Descubre el poder del Xiaomi Redmi Note 13 Pro 5G 256GB Negro, un dispositivo que fusiona tecnología avanzada con un diseño elegante y moderno.

La pantalla del Xiaomi Redmi Note 13 Pro 5G es una maravilla visual, ofreciendo una experiencia inmersiva con su panel AMOLED de 6.67 pulgadas. Con una resolución Full HD+ de 2400 x 1080 píxeles, cada imagen se muestra con detalles vibrantes y colores impresionantes, ideal para disfrutar de tus contenidos favoritos con la máxima calidad.

En cuanto a sus dimensiones, el Xiaomi Redmi Note 13 Pro 5G está diseñado para ser ergonómico y portátil. Con unas medidas aproximadas de 161.6 x 75.8 x 8.2 mm y un peso de alrededor de 189 gramos, se adapta cómodamente a tu mano y es fácil de llevar a cualquier parte.

Este modelo viene equipado con una impresionante capacidad de almacenamiento de 256GB, lo que te ofrece un amplio espacio para todas tus aplicaciones, fotos, videos y más. Además, cuenta con 8GB de RAM, asegurando un rendimiento fluido y eficiente, incluso al ejecutar múltiples tareas simultáneamente.

La cámara del Xiaomi Redmi Note 13 Pro 5G es un sistema versátil que te permite capturar cada momento con claridad y precisión. Su configuración de cámara trasera triple incluye un sensor principal de 108 MP, que garantiza fotos nítidas y detalladas. Además, ofrece características avanzadas como el modo nocturno y la grabación de video en 4K, para que puedas llevar tu creatividad al siguiente nivel.

Impulsado por el potente procesador Qualcomm Snapdragon 7 Gen 1, el Xiaomi"
