generic_name,commercial_name,description
KIT SMG GXA25256GA256 AM,Samsung Galaxy A25 256GB Amarillo,"Descubre el Samsung Galaxy A25 256GB Amarillo, un dispositivo diseñado para aquellos que buscan rendimiento y estilo en un solo paquete. Este smartphone ofrece una experiencia visual impresionante gracias a su pantalla Super AMOLED de 6.5 pulgadas, con una resolución Full HD+ que garantiza colores vibrantes y detalles nítidos.

Con dimensiones compactas de 159.7 x 74 x 8.4 mm y un peso de aproximadamente 185 gramos, el Samsung Galaxy A25 se siente cómodo en la mano, ofreciendo portabilidad sin comprometer el tamaño de la pantalla.

Equipado con 256GB de almacenamiento interno, el Samsung Galaxy A25 te brinda espacio más que suficiente para tus aplicaciones, fotos y videos. Además, con 6GB de RAM, disfrutarás de un rendimiento fluido incluso al realizar múltiples tareas.

La cámara del Samsung Galaxy A25 es ideal para capturar tus momentos especiales. Con un sistema de triple cámara que incluye un sensor principal de 50 MP, obtendrás fotos claras y detalladas en cualquier entorno. La cámara frontal de 13 MP es perfecta para selfies impresionantes.

El Samsung Galaxy A25 incorpora un procesador Octa-core que combina eficiencia y potencia, garantizando un rendimiento óptimo en todas tus aplicaciones diarias.

La batería de 5,000 mAh del Samsung Galaxy A25 te asegura energía suficiente para todo el día, con una duración estimada que soporta largas horas de uso sin necesidad de recargar.

El Samsung Galaxy A25 256GB Amarillo es la elección perfecta para quienes buscan un dispositivo moderno, potente y con estilo."
KIT SMG GXA16256GA166 NG,Samsung Galaxy A16 256GB Negro,"Descubre el Samsung Galaxy A16 256GB en elegante color negro, un dispositivo diseñado para ofrecer un rendimiento excepcional y una experiencia visual superior. 

La pantalla del Samsung Galaxy A16 es una PLS LCD de 6.5 pulgadas, con una resolución de 720 x 1600 píxeles. Esta tecnología garantiza una visualización nítida y clara, ideal para disfrutar de tus contenidos favoritos con colores vibrantes y detalles precisos.

Con unas dimensiones de aproximadamente 164.2 x 75.9 x 9.1 mm y un peso de 195 gramos, el Samsung Galaxy A16 combina estilo y comodidad, facilitando su manejo y transporte en cualquier situación.

Este modelo ofrece una generosa capacidad de almacenamiento interno de 256GB, permitiéndote guardar tus aplicaciones, fotos y documentos con total libertad. Además, cuenta con 4GB de RAM que aseguran un rendimiento fluido y eficiente.

La cámara del Samsung Galaxy A16 es una de sus características más destacadas, equipada con un sistema de triple lente que incluye un sensor principal de 48 MP. Captura imágenes impresionantes y graba videos de alta calidad con facilidad y precisión.

En su interior, el Samsung Galaxy A16 alberga un potente procesador MediaTek Helio G35, basado en una arquitectura octa-core que optimiza el rendimiento del dispositivo, incluso al ejecutar aplicaciones exigentes o al realizar multitarea.

La batería del Samsung Galaxy A16 tiene una capacidad de 5000 mAh, lo que proporciona una duración excepcional que te permitirá disfrutar de todas sus funciones durante todo el día sin preocuparte por la carga frecuente.

El Samsung Galaxy A16 256GB Negro es la elección perfecta para quienes buscan un smartphone que combine"
KIT SMG GXA25256GA 256 AZ,Samsung Galaxy A25 256GB Azul,"Descubre el impresionante Samsung Galaxy A25 256GB Azul, un dispositivo que combina estilo y funcionalidad para llevar tu experiencia móvil al siguiente nivel.

Pantalla: Disfruta de una visualización vibrante y clara en su pantalla Super AMOLED de 6.5 pulgadas, con una resolución FHD+ de 1080 x 2400 píxeles. Esta tecnología ofrece colores intensos y negros profundos, ideal para disfrutar de tus contenidos favoritos con la mejor calidad.

Dimensiones y Peso: Con un diseño elegante y moderno, el Samsung Galaxy A25 mide aproximadamente 162 x 75 x 8.3 mm y pesa alrededor de 185 gramos, lo que lo hace cómodo de sostener y fácil de llevar a cualquier lugar.

Capacidad: Equipado con una generosa capacidad de almacenamiento de 256GB, podrás guardar todas tus fotos, videos y aplicaciones sin preocuparte por el espacio. Además, cuenta con 8GB de RAM para asegurar un rendimiento fluido y eficiente, incluso al realizar múltiples tareas.

Cámara: Captura momentos inolvidables con su potente sistema de cámara cuádruple. La cámara principal de 64 MP ofrece imágenes nítidas y detalladas, mientras que el lente ultra gran angular, el sensor de profundidad y la lente macro te permiten explorar tu creatividad fotográfica desde diferentes perspectivas.

Procesador: Impulsado por el potente chip Exynos 1280 de arquitectura Octa-Core, el Samsung Galaxy A25 garantiza un desempeño rápido y eficiente, optimizando la ejecución de aplicaciones y el consumo de energía para una experiencia de usuario excepcional.

Batería: Con una batería de 5000 mAh, el Samsung Galaxy A25 te acompaña durante todo el día,"
KIT SMG GXYA155G256GB AZ,Samsung Galaxy A15 5G 256GB Azul,"Descubre la potencia y elegancia del Samsung Galaxy A15 5G 256GB Azul, un dispositivo diseñado para ofrecerte una experiencia móvil excepcional. 

La pantalla del Samsung Galaxy A15 5G es una pieza central de tecnología avanzada, con un tipo de pantalla Super AMOLED que proporciona colores vibrantes y un contraste impresionante. Con una resolución Full HD+ de 2400 x 1080 píxeles, cada imagen y video se presentan con una claridad asombrosa, haciendo que cada interacción visual sea un deleite.

En cuanto a sus dimensiones y peso, el Samsung Galaxy A15 5G está diseñado para ser manejable y cómodo. Con unas medidas aproximadas de 164 x 75 x 8.8 mm y un peso de alrededor de 190 gramos, este dispositivo es fácil de transportar y manejar, sin sacrificar la robustez necesaria para el uso diario.

El Samsung Galaxy A15 5G ofrece una capacidad de almacenamiento impresionante con 256GB, lo que te asegura espacio más que suficiente para tus aplicaciones, fotos y archivos multimedia. Complementado con 8GB de RAM, este smartphone garantiza un rendimiento fluido y eficiente incluso en las tareas más exigentes.

La cámara del Samsung Galaxy A15 5G es una herramienta poderosa para capturar tus momentos favoritos. Con un sistema de triple cámara trasera que incluye un sensor principal de 48 MP, una lente ultra gran angular de 8 MP y un sensor de profundidad de 5 MP, cada foto es una obra maestra de detalle y color. La cámara frontal de 16 MP asegura selfies nítidos y vibrantes.

Bajo el capó, el Samsung Galaxy A15 5G está equipado con un procesador oct"
KIT SMG GXYA155G256GB AM,Samsung Galaxy A15 5G 256GB Amarillo,"El Samsung Galaxy A15 5G 256GB Amarillo es un dispositivo que combina estilo y rendimiento en un diseño vibrante y moderno. Este smartphone está equipado con una pantalla de tecnología Super AMOLED de 6.5 pulgadas, ofreciendo una resolución Full HD+ que garantiza colores vivos y una claridad impresionante para todas tus actividades diarias.

Con dimensiones de aproximadamente 164.2 x 75.9 x 8.9 mm y un peso de alrededor de 190 gramos, el Samsung Galaxy A15 5G es cómodo de sostener y fácil de llevar a cualquier parte, sin sacrificar la calidad de su construcción.

Este modelo ofrece una generosa capacidad de almacenamiento de 256GB, permitiéndote guardar todas tus fotos, aplicaciones y documentos sin preocuparte por el espacio. Acompañado de 8GB de RAM, el Samsung Galaxy A15 5G asegura un rendimiento fluido y eficiente, ideal para el multitasking y el uso de aplicaciones exigentes.

La cámara del Samsung Galaxy A15 5G es una de sus características destacadas, con un sistema de cámara triple que incluye un sensor principal de 50 MP, asegurando fotos nítidas y de alta calidad. Además, cuenta con una cámara ultra gran angular y un sensor de profundidad, brindando versatilidad para capturar cada momento con detalle.

El dispositivo está impulsado por un procesador MediaTek Dimensity 720, diseñado con una arquitectura de 7nm, que ofrece un equilibrio perfecto entre potencia y eficiencia, optimizando el consumo de energía mientras proporciona un rendimiento robusto para todas tus necesidades.

La batería de 5000 mAh del Samsung Galaxy A15 5G garantiza que puedas disfrutar de tu teléfono todo el"
KIT SMG GXYA35256GA35 AZ,Samsung Galaxy A35 256GB Azul,"El Samsung Galaxy A35 256GB Azul es un smartphone diseñado para aquellos que buscan un equilibrio entre rendimiento y estilo. Este dispositivo cuenta con una pantalla Super AMOLED de 6.5 pulgadas, que ofrece una resolución Full HD+ de 1080 x 2400 píxeles, brindando imágenes nítidas y colores vibrantes para una experiencia visual impresionante.

Sus dimensiones compactas de 162.1 x 76.4 x 8.3 mm y un peso aproximado de 190 gramos, hacen que el Samsung Galaxy A35 sea cómodo de sostener y fácil de llevar a cualquier lugar. La capacidad de almacenamiento de 256GB, junto con 6GB de RAM, asegura que tengas espacio de sobra para tus aplicaciones, fotos, y videos, además de un rendimiento fluido en multitareas.

El sistema de cámaras del Samsung Galaxy A35 es impresionante, con una cámara principal de 64 MP que garantiza fotos claras y detalladas. Además, incluye una cámara ultra gran angular de 12 MP, una cámara macro de 5 MP y un sensor de profundidad de 5 MP, para capturar cada momento desde cualquier perspectiva.

En su interior, el Samsung Galaxy A35 está equipado con el procesador Exynos 1280, un chip de ocho núcleos que utiliza una arquitectura de 5 nm, permitiendo un rendimiento potente y eficiente en el consumo de energía. La batería de 5,000 mAh te ofrece la libertad de usar tu dispositivo durante todo el día, con una duración estimada que soporta navegación, juegos y transmisión de contenido sin interrupciones.

El Samsung Galaxy A35 256GB Azul es la elección perfecta para quienes buscan un smartphone que combine funcionalidad avanzada con un diseño"
KIT SMG GXYS24FE256GF NG +SMAND FIT3,Samsung Galaxy S24 FE 256GB Negro + SmartBand FIT3,"Descripción Técnica y Promocional del Samsung Galaxy S24 FE 256GB Negro + SmartBand FIT3

Descubre el Samsung Galaxy S24 FE 256GB Negro, la combinación perfecta de tecnología avanzada y diseño elegante, ahora acompañado de la innovadora SmartBand FIT3 para una experiencia completa.

Pantalla: Disfruta de una experiencia visual impresionante con la pantalla Dynamic AMOLED 2X de 6.4 pulgadas, que ofrece una resolución Full HD+ de 2340 x 1080 píxeles. Esta tecnología proporciona colores vivos y un brillo excepcional, haciendo que cada imagen cobre vida.

Dimensiones y Peso: El Samsung Galaxy S24 FE presenta un diseño estilizado con dimensiones de 159.9 x 74.5 x 8.4 mm y un peso aproximado de 190 gramos, lo que asegura comodidad y portabilidad sin sacrificar el estilo.

Capacidad: Equipado con 256GB de almacenamiento interno, el Samsung Galaxy S24 FE ofrece espacio más que suficiente para todas tus aplicaciones, fotos y videos. Además, cuenta con 8GB de RAM para un rendimiento fluido y multitarea sin interrupciones.

Cámara: Captura tus momentos más preciados con su sistema de triple cámara trasera que incluye un sensor principal de 50 MP, un ultra gran angular de 12 MP y un teleobjetivo de 8 MP. La cámara frontal de 32 MP garantiza selfies nítidos y detallados.

Procesador: En su corazón, el Samsung Galaxy S24 FE incorpora el potente procesador Exynos 2200, basado en una arquitectura de 4 nanómetros que optimiza el rendimiento y la eficiencia energética.

Batería: Con"
KIT SMG GXYA35256GA35 AM,Samsung Galaxy A35 256GB Azul,"Descubre el Samsung Galaxy A35 256GB Azul, un dispositivo que combina estilo y funcionalidad para ofrecerte una experiencia móvil excepcional.

Pantalla: El Samsung Galaxy A35 cuenta con una impresionante pantalla Super AMOLED de 6.5 pulgadas, que ofrece una resolución Full HD+ de 2400 x 1080 píxeles. Experimenta colores vibrantes y detalles nítidos, perfectos para disfrutar de tus contenidos multimedia favoritos con una claridad impresionante.

Dimensiones y Peso: Este elegante dispositivo tiene unas dimensiones aproximadas de 160.1 x 74.4 x 8.5 mm y un peso de 185 gramos, lo que lo hace cómodo de sostener y fácil de llevar a cualquier lugar.

Capacidad: Con una generosa capacidad de almacenamiento de 256GB, el Samsung Galaxy A35 te permite guardar todos tus archivos, fotos y aplicaciones sin preocuparte por el espacio. Además, cuenta con 8GB de RAM para asegurar un rendimiento fluido y eficiente en multitarea.

Cámara: Captura tus momentos favoritos con su avanzada cámara trasera cuádruple, que incluye un sensor principal de 64 MP, una lente ultra gran angular de 12 MP, un sensor de profundidad de 5 MP y una lente macro de 5 MP. La cámara frontal de 32 MP te asegura selfies perfectas en cualquier situación.

Procesador: Equipado con el potente procesador Exynos 1280 de 8 núcleos, el Samsung Galaxy A35 ofrece un rendimiento excepcional y una eficiencia energética mejorada, asegurando que todas tus aplicaciones y juegos favoritos funcionen sin problemas.

Batería: Gracias a su batería de 5000 mAh, el Samsung Galaxy A35"
KIT SMG GXYS24FE256GF GR + SMANDFIT3,Samsung Galaxy S24 FE 256GB Gris + Smart Band Fit 3,"Descubre el Samsung Galaxy S24 FE 256GB Gris + Smart Band Fit 3, una combinación perfecta de innovación y estilo. 

El Samsung Galaxy S24 FE te ofrece una experiencia visual inigualable con su pantalla Dynamic AMOLED 2X de 6.4 pulgadas, que ofrece una resolución Full HD+ de 2340 x 1080 píxeles. Disfruta de colores vibrantes y detalles nítidos en cada imagen.

Con dimensiones de 159.9 x 74.5 x 8.4 mm y un peso de 190 gramos, el Galaxy S24 FE está diseñado para adaptarse cómodamente en tu mano, sin sacrificar un diseño moderno y elegante.

Equipado con una capacidad de almacenamiento de 256GB y 8GB de RAM, este dispositivo te asegura espacio suficiente para tus aplicaciones, fotos y videos, garantizando una experiencia multitarea fluida y eficiente.

La cámara del Samsung Galaxy S24 FE es un verdadero punto de referencia, con un sistema de triple cámara que incluye un sensor principal de 50 MP, un ultra gran angular de 12 MP y un teleobjetivo de 8 MP. Captura tus momentos favoritos con una claridad y detalle excepcionales.

Impulsado por el potente procesador Exynos 2200, con arquitectura de 5 nanómetros, el Galaxy S24 FE ofrece un rendimiento superior y eficiente, capaz de manejar las tareas más exigentes con facilidad.

La batería de 4500 mAh del Samsung Galaxy S24 FE te proporciona energía para todo el día, con una carga rápida que te asegura menos tiempo conectado y más tiempo disfrutando de su funcionalidad.

Completa tu experiencia con la Smart Band Fit 3, que monitorea"
KIT TCL 40SE128GT610E DG,TCL 40 SE 128GB Gris,"El TCL 40 SE 128GB Gris es un smartphone diseñado para ofrecer un equilibrio perfecto entre rendimiento y estilo. Equipado con una pantalla IPS LCD de 6.75 pulgadas, ofrece una resolución de 720 x 1600 píxeles, que brinda colores vibrantes y detalles nítidos para una experiencia visual envolvente.

Con dimensiones de 166.2 x 76 x 8.5 mm y un peso de aproximadamente 190 gramos, el TCL 40 SE es cómodo de manejar y ligero para llevar a todas partes. Su diseño es tanto funcional como elegante, adaptándose a tu estilo de vida con facilidad.

En términos de capacidad, el TCL 40 SE cuenta con 128GB de almacenamiento interno, ampliable mediante tarjeta microSD, y está respaldado por 4GB de RAM. Esta combinación asegura un rendimiento fluido y suficiente espacio para todas tus aplicaciones, fotos y archivos importantes.

La cámara del TCL 40 SE es otro de sus puntos fuertes, integrando un sistema de triple cámara trasera con un sensor principal de 50 MP, acompañado de un lente de profundidad de 2 MP y un lente macro de 2 MP. Captura imágenes impresionantes con gran detalle y claridad, incluso en condiciones de poca luz.

Equipado con un procesador MediaTek Helio G37 de arquitectura Octa-core, el TCL 40 SE garantiza un rendimiento eficiente y veloz, permitiendo ejecutar múltiples aplicaciones y juegos sin esfuerzo.

La batería de 5000 mAh asegura que el TCL 40 SE esté listo para acompañarte durante todo el día, ofreciendo una duración prolongada para que no tengas que preocuparte por quedarte sin energía en momentos cruciales.

El TCL 40 SE 128"
KIT TCL 40SE256GT610E2 MR + AUDTCLTW18,TCL 40 SE 256GB Morado + Audifonos TCL TW18,"El TCL 40 SE 256GB Morado + Audífonos TCL TW18 es un dispositivo que combina elegancia y rendimiento, diseñado para quienes buscan calidad y estilo en cada detalle. 

La pantalla del TCL 40 SE es un panel IPS de 6.75 pulgadas con resolución HD+ de 720 x 1600 píxeles. Ofrece colores vibrantes y una claridad impresionante, ideal para disfrutar de tus contenidos multimedia favoritos con una calidad visual excepcional.

Con dimensiones de 167.5 x 76.5 x 8.5 mm y un peso aproximado de 190 gramos, el TCL 40 SE es cómodo de sostener y transportar, ofreciendo un diseño ergonómico que se adapta perfectamente a tu mano.

Este modelo viene con una generosa capacidad de almacenamiento de 256GB, expandible mediante tarjeta microSD, y está equipado con 6GB de RAM, permitiendo una experiencia fluida y sin interrupciones al realizar multitareas o ejecutar aplicaciones exigentes.

La cámara principal del TCL 40 SE destaca con un sistema de triple lente, que incluye un sensor de 50 MP para capturar fotos detalladas y nítidas, junto con sensores adicionales que mejoran la profundidad y el enfoque en tus tomas.

Impulsado por un procesador MediaTek Helio G37 de ocho núcleos, este smartphone ofrece una arquitectura eficiente que asegura un desempeño potente y eficiente, optimizando el uso de energía para prolongar la duración de la batería.

La batería de 5000 mAh garantiza un uso prolongado durante el día, permitiéndote disfrutar de tus actividades sin preocuparte por quedarte sin carga. Además, con la tecnología de carga rápida, estarás siempre listo para"
KIT TEC SP20PRPL256GB VR,Tecno Spark 20 Pro Plus 256GB Verde,"El Tecno Spark 20 Pro Plus 256GB Verde es un dispositivo impresionante diseñado para aquellos que buscan un rendimiento excepcional combinado con un diseño elegante y moderno. 

La pantalla del Tecno Spark 20 Pro Plus es una pieza de tecnología avanzada, con un panel IPS LCD de 6.8 pulgadas que ofrece una resolución Full HD+ de 1080 x 2400 píxeles. Esto garantiza colores vibrantes y detalles nítidos, perfectos para disfrutar de contenido multimedia y juegos con claridad excepcional.

En cuanto a sus dimensiones y peso, el Tecno Spark 20 Pro Plus se presenta con unas medidas aproximadas de 168.6 x 77.8 x 8.4 mm, y un peso que ronda los 190 gramos, lo que lo hace cómodo de sostener y fácil de manejar durante todo el día.

El dispositivo ofrece una impresionante capacidad de almacenamiento de 256GB, asegurando espacio más que suficiente para todas tus aplicaciones, fotos y documentos. Acompañado de 8GB de RAM, el Tecno Spark 20 Pro Plus garantiza un rendimiento fluido y eficiente, incluso al realizar múltiples tareas simultáneamente.

La cámara es uno de los puntos fuertes del Tecno Spark 20 Pro Plus. Cuenta con un sistema de cámara cuádruple liderado por un sensor principal de 48 MP, que permite capturar imágenes detalladas y vibrantes. Las funciones adicionales como el modo nocturno y la grabación de video en alta definición añaden versatilidad a tus experiencias fotográficas.

Bajo el capó, el Tecno Spark 20 Pro Plus está equipado con un potente procesador MediaTek Helio G95, de arquitectura octa-core. Este chip está diseñado"
KIT TCL 40SE256T610E2 DG +AUDTCLTW18,TCL 40SE 256GB Gris + Audifonos TCL TW18,"Descubre el poder y la elegancia del TCL 40SE 256GB Gris + Audífonos TCL TW18, un dispositivo que combina tecnología avanzada con un diseño sofisticado para ofrecerte una experiencia móvil inigualable.

Con una impresionante pantalla IPS LCD de 6.75 pulgadas, el TCL 40SE proporciona una resolución HD+ de 720 x 1600 píxeles. Esta tecnología te garantiza colores vibrantes y detalles nítidos para disfrutar de tus contenidos multimedia favoritos con la mejor calidad visual.

Diseñado para la comodidad y el estilo, el TCL 40SE mide aproximadamente 167.5 x 76.5 x 8.5 mm y pesa alrededor de 190 gramos, lo que lo hace perfecto para llevar a todas partes sin sacrificar el confort. 

En cuanto al almacenamiento, este dispositivo ofrece 256GB de memoria interna, ideal para guardar todas tus fotos, videos y aplicaciones sin preocuparte por el espacio. Además, con 6GB de RAM, podrás disfrutar de un rendimiento fluido y eficiente, incluso al realizar múltiples tareas.

Captura tus momentos más preciados con la cámara principal triple del TCL 40SE, que incluye un sensor principal de 50 MP, un lente macro de 2 MP y un sensor de profundidad de 2 MP, permitiéndote tomar fotos impresionantes en cualquier situación. La cámara frontal de 8 MP garantiza selfies perfectas y videollamadas claras.

Impulsado por un procesador MediaTek Helio G37 de ocho núcleos, el TCL 40SE ofrece un equilibrio perfecto entre rendimiento y eficiencia energética, asegurando que tus aplicaciones y juegos favoritos funcionen sin problemas.

La batería de 5010 mAh del TCL"
KIT TEC CAM305G512GB NG +BUDS,Tecno Camon 30 5G 512GB Negro + BUDS,"El Tecno Camon 30 5G 512GB Negro + BUDS es un dispositivo que combina tecnología de vanguardia con un diseño elegante y moderno. Equipado con una impresionante pantalla IPS LCD de 6.8 pulgadas, ofrece una resolución Full HD+ de 1080 x 2460 píxeles, lo que garantiza colores vibrantes y una claridad excepcional en cada imagen.

Con unas dimensiones aproximadas de 168.4 mm x 76.5 mm x 8.8 mm y un peso de alrededor de 190 gramos, el Tecno Camon 30 5G es cómodo de sostener y fácil de llevar a cualquier parte. Este modelo ofrece una impresionante capacidad de almacenamiento interno de 512GB, ampliable mediante tarjeta microSD, y está respaldado por 8GB de RAM, lo que asegura un rendimiento fluido y eficiente incluso en las tareas más exigentes.

La cámara del Tecno Camon 30 5G es un verdadero punto culminante, presentando un sistema de triple lente trasera con un sensor principal de 64 MP, que captura imágenes nítidas y detalladas, junto con funciones avanzadas para fotografía nocturna y grabación de video en alta resolución.

En su interior, el Tecno Camon 30 5G está impulsado por un potente procesador MediaTek Dimensity 700, basado en una arquitectura de 7nm, que no solo proporciona un rendimiento sobresaliente sino también una eficiencia energética mejorada.

La batería de 5000 mAh asegura una duración prolongada, permitiendo al usuario disfrutar de todas las funciones del teléfono durante todo el día sin preocuparse por la carga.

Incluye además los BUDS"
KIT TEC SP20PRPL256GB BL,Tecno Spark 20 Pro Plus Blanco,"El Tecno Spark 20 Pro Plus Blanco es la combinación perfecta entre estilo y rendimiento, diseñado para aquellos que buscan un dispositivo con capacidades avanzadas y un diseño elegante.

La pantalla del Tecno Spark 20 Pro Plus Blanco es una obra maestra de visualización. Con una pantalla IPS LCD de 6.8 pulgadas y una resolución de 1080 x 2460 píxeles, ofrece imágenes nítidas y colores vibrantes, ideales para disfrutar de contenido multimedia con la máxima calidad.

En términos de dimensiones, el equipo se presenta con medidas de 168.6 x 76.8 x 8.77 mm y un peso aproximado de 200 gramos, lo que lo hace cómodo de sostener y fácil de llevar a cualquier lugar.

El almacenamiento y la memoria RAM son aspectos destacados del Tecno Spark 20 Pro Plus Blanco. Ofrece opciones de almacenamiento interno de 128 GB, acompañadas por una memoria RAM de 8 GB, asegurando un rendimiento fluido y espacio suficiente para todas tus aplicaciones y archivos importantes.

La cámara del Tecno Spark 20 Pro Plus Blanco no decepciona, con una configuración de triple cámara trasera que incluye un sensor principal de 50 MP, ideal para capturar momentos con gran detalle y claridad. La cámara frontal de 16 MP asegura selfies de alta calidad y videollamadas claras.

Equipado con un potente procesador MediaTek Helio G95, el Tecno Spark 20 Pro Plus Blanco ofrece una experiencia de usuario rápida y eficiente, optimizando el consumo de energía y mejorando el rendimiento en tareas diarias y juegos.

La batería de 5000 mAh del Tecno Spark 20 Pro Plus Blanco garantiza una larga duración, permitiendo"
